"id_training_data";"id_berita";"id_topik";"berita";"training_class"
"1167";"1351";"1";"Fahri Komentari Foto Cak Imin Bareng Puan Berhijab";"None"
"1168";"1352";"1";"Pertemuan Akrab Prabowo Dan SBY Tanda-Tanda Ganti Presiden Semakin Dekat";"None"
"1169";"1353";"1";"OSO: Aturan BK DPD Berlaku Untuk Semua Anggota";"None"
"1170";"1354";"1";"Demokrat: Arah Jari Tangan SBY Sudah Pasti, Jangan Diolah Lagi";"None"
"1171";"1355";"1";"Hinca: Demokrat Lari Kencang Topang Koalisi Adil Makmur";"None"
"1172";"1356";"1";"Usai Deklarasi, MCM Segera Ajak Jokowi Keliling Masjid";"None"
"1173";"1357";"1";"Noer Fajrieansyah Dinilai Punya Kapasitas Satukan KNPI";"None"
"1174";"1358";"1";"Pemerintah Harus Tegas Sikapi Kekerasan Di Xinjiang";"None"
"1175";"1359";"1";"SBY Dan Prabowo Bertemu, Fahri Hamzah: Perang Total Ini!";"None"
"1176";"1360";"1";"Golkar DKI Mulai Sosialisasikan Rambu Pemilu Ke Kader";"None"
"1177";"1361";"1";"Kritikus Di Lereng Merapi: Aura Kemenangan Prabowo Kian Terasa";"None"
"1178";"1362";"1";"KPK Harus Lari Maraton Telusuri Keuangan Asian Games";"None"
"1179";"1363";"1";"Kader Nasdem Diusir Saat Kawal Surya Paloh Di Jember";"None"
"1180";"1364";"1";"Pujian Yenny Wahid Ke Jokowi Kelewat Matang Sampai-Sampai Gosong";"None"
"1181";"1365";"1";"PKS Minta Gerindra Juga Gencar Perkenalkan Calon Wagub DKI";"None"
"1182";"1366";"1";"Prabowo: Selama Dipimpin SBY Indonesia Tidak Ada Gejolak";"None"
"1183";"1367";"1";"Cegah Kecurangan Pemilu, BPN Lantik 70 Satgas Di Ibukota";"None"
"1184";"1368";"1";"SBY Khawatir Terjadi Kecurangan Di Pemilu 2019";"None"
"1185";"1369";"1";"SBY Minta Prabowo Kampanye Hingga Pelosok Daerah Untuk Jelaskan Visi Misi";"None"
"1187";"1371";"1";"SBY: Tolong, Kami Jangan Diganggu!";"None"
"1188";"1372";"1";"Benarkah Amerika Menang Di Suriah?";"None"
"1189";"1373";"1";"Prabowo: Saya Tidak Pernah Ragu Dengan Komitmen Pak SBY";"None"
"1190";"1374";"1";"Pesan SBY Dan Prabowo Usai Rapat Koalisi";"None"
"1191";"1375";"1";"PDIP: Insiden Pemotongan Nisan Salib Tak Perlu Dibesar-Besarkan";"None"
"1193";"1377";"2";"Freeport Ditagih Rp 460 Miliar Pakai Hutan Lindung Tanpa Izin";"None"
"1194";"1378";"2";"Petani Tembakau Masih Ketar-ketir";"None"
"1195";"1379";"2";"Industri Pulp & Kertas Masih Dihantui Isu Dumping";"None"
"1196";"1380";"2";"AP I Dapat Suntikan Rp 5 T dari 3 BUMN";"None"
"1198";"1382";"2";"Kebijakan Pungutan Cukai Buat Ngerem Sampah Plastik";"None"
"1199";"1383";"2";"Huntara Yang Dibangun Kementerian PUPR Mulai Ditempati";"None"
"1200";"1384";"2";"Menaker: BLK Kemnaker Tak kalah Dengan BLK Taiwan";"None"
"1201";"1385";"2";"PLN Resmikan Integrasi Data Perpajakan Dengan DJP";"None"
"1202";"1386";"2";"PGN Klaim Ikut Prosedur Dalam Proyek Kalija I";"None"
"1203";"1387";"2";"Imbauan Wapres Untuk PMI: Banyak Lapangan Kerja Di Negeri Sendiri";"None"
"1205";"1389";"2";"Di Sukabumi, Wapres JK Serahkan Kartu Perlindungan BPJS-TK Kepada Pekerja Migran";"None"
"1207";"1391";"2";"Jembatan Darurat Padang-Bukittinggi Bisa Dilalui Satu Jalur";"None"
"1208";"1392";"2";"Tingkatkan Konservasi Lahan dan Air, Kementerian PUPR Tanam 126 Ribu Pohon Serentak di 34 Provinsi";"None"
"1209";"1393";"2";"Kementerian PUPR Selesaikan Sejumlah Pembangunan Infrastruktur Di Aceh";"None"
"1210";"1394";"2";"Ekspor Non Migas Indonesia Turun";"None"
"1213";"1397";"2";"BI: Cuma Untuk Turis Asing";"None"
"1214";"1398";"2";"Krakatau Steel Happy";"None"
"1215";"1399";"2";"BUMN Rayakan Natal Dan Berbagi Santunan Dengan Anak Panti Asuhan Di Sulawesi Utara";"None"
"1216";"1400";"2";"Harga Sawit Turun Drastis, Jokowi: Tanam Saja Jengkol, Petai Hingga Manggis";"None"
"1217";"1401";"2";"Kemenag Waswas VFS Tasheel Merepotkan Calon Jamaah Umrah";"None"
"1218";"1402";"2";"Pemerintah Perlu Terapkan 12 Standar Transparansi Pengelolaan Perikanan";"None"
"1220";"1404";"2";"Pengusaha Batubara Kelimpungan";"None"
"1222";"1406";"2";"Keterangan Asuransi Tugu Menyesatkan Keluarga Korban Lion Air JT610";"None"
"1223";"1407";"2";"Bendungan Rotiklot Mulai Diisi Air";"None"
"1224";"1408";"2";"Tahun Ini Pemerintah Indonesia Tidak Dapat Utang Bilateral, Ada Apa Ya?";"None"
"1226";"1410";"2";"Perubahan Kapasitas Bagasi Lion Air Dan Wings Air Ditunda Hingga 8 Januari";"None"
"1228";"1412";"2";"Kini, Ribuan Rumah Di Dogiyai Bebas Gelap Dengan LTSHE";"None"
"1229";"1413";"2";"Perusahaan Plat Merah Sedang Susah, Harus Beralih Ke Energi Terbarukan";"None"
"1231";"1415";"2";"BUMN Lebih Baik Bangun Kerja Sama Ketimbang Menumpuk Utang";"None"
"1233";"1417";"2";"Menteri Jonan Pastikan Listrik Di Jateng Dan DIY Aman Saat Natal";"None"
"1234";"1418";"2";"Kejahatan Pemerintah Merusak Infrastruktur, Ke Bandung Harus Pikir-pikir 12 Kali";"None"
"1235";"1419";"2";"BPJPH Dianggap Tak Realistis Targetkan Rp 22,5 Triliun";"None"
"1236";"1420";"2";"Bos BI Tak Patah Arang";"None"
"1237";"1421";"2";"Korban Lion Air Gugat Boeing 100 Juta Dolar";"None"
"1238";"1422";"2";"Wapres Dorong Dana Haji Segera Diinvestasikan";"None"
"1239";"1423";"2";"Tak Jadi Dibubarkan, Kepala BP Batam Dirangkap Walikota";"None"
"1240";"1424";"2";"Kecewa, Jokowi Bubarkan Badan Pengusahaan Batam";"None"
"1243";"1427";"2";"Kementerian PUPR Terima Medali Emas Simpul Jaringan Geospasial";"None"
"1244";"1428";"2";"Minim Perempuan Terjun Di Sektor Maritim";"None"
"1245";"1429";"2";"Jokowi: Jangan Ada Mark Up";"None"
"1246";"1430";"2";"AP I Genjot Sektor Pariwisata Di NTT";"None"
"1249";"1433";"2";"Kementerian PUPR Raih Penghargaan Dari Ombudsman";"None"
"1251";"1435";"2";"Kunjungi Seoul, BPJS Ketenagakerjaan Ingin Jamin Perlindungan PMI";"None"
"1252";"1436";"3";"Di Banten, 26 Jenazah Masih Diidentifikasi Sementara 3 Jenazah Belum Diambil Pihak Keluarga";"None"
"1253";"1437";"3";"Misa Terakhir, Jemaat Katedral Diminta Amalkan Sila Keempat Pancasila";"None"
"1255";"1439";"3";"Menkes Pastikan Stok Obat Bagi Korban Tsunami Cukup";"None"
"1257";"1441";"3";"Pemberantasan Minuman Beralkohol Oplosan Mendesak Dilakukan";"None"
"1258";"1442";"3";"Relawan Gojo Salurkan Bantuan Untuk Korban Tsunami";"None"
"1259";"1443";"3";"Bawa 21 Truk Bantuan, Polda Metro Buka Posko Kemanusiaan Di Pandeglang";"None"
"1260";"1444";"3";"Tiada Lagi Ali Shahab";"None"
"1262";"1446";"3";"Tim Penyelamat Evakuasi Dua Jenazah Mengapung Di Laut";"None"
"1263";"1447";"3";"RSUD Pandeglang Sudah Terima Lemari Pendingin Untuk Jenazah";"None"
"1264";"1448";"3";"Hanneke Jadikan Gereja Immanuel Tempat Ibadah Favorit";"None"
"1268";"1452";"3";"Ketum KNPI Dengar Keluhan Pengungsi Di Pandeglang";"None"
"1270";"1454";"3";"KNPI Kirim Bantuan Untuk Pengungsi Banten";"None"
"1272";"1456";"3";"BNPB Prediksi Jumlah Korban Tsunami Selat Sunda Akan Terus Bertambah";"None"
"1273";"1457";"3";"PUPR Turunkan 24 Alat Berat Bersihkan Puing-Puing Bangunan Di Lampung Selatan";"None"
"1274";"1458";"3";"Uskup Agung Jakarta: Agama Diperalat Untuk Kepentingan Politik";"None"
"1275";"1459";"3";"Update BNPB: 429 Meninggal, 1.485 Luka-luka, Dan 154 Masih Hilang";"None"
"1277";"1461";"3";"Satu Korban Meninggal Ditemukan Selasa Pagi";"None"
"1279";"1463";"3";"5 Menit Drama Anak-anak Peduli Bencana Tsunami";"None"
"1280";"1464";"3";"Uskup Agung Jakarta: Umat Katolik Tidak Boleh Memecah Belah Bangsa";"None"
"1281";"1465";"3";"Peringati Hari Ibu, Istri Dubes Negara Sahabat Kulineran Italia Rasa Indonesia";"None"
"1283";"1467";"3";"Khutbah Berbahasa Belanda Tidak Hilang Dari Gereja Immanuel Gambir";"None"
"1284";"1468";"3";"Pejabat Kominfo Menggunakan Zawo Zambu Saat Misa Natal Di Katedral";"None"
"1285";"1469";"3";"Polda Banten Fokus Evakuasi Di Kecamatan Sumur";"None"
"1286";"1470";"3";"Natalan Di Gereja Immanuel Dijaga Ketat, Ada Baracuda Siaga";"None"
"1287";"1471";"3";"PLN Beri Bantuan Medis Dan Nonmedis Untuk Korban Tsunami";"None"
"1288";"1472";"3";"Misa Natal Katedral Doakan Korban Tsunami Selat Sunda";"None"
"1289";"1473";"3";"Drama Tsunami Selat Sunda Di Misa Keluarga Katedral";"None"
"1290";"1474";"3";"Polda Banten Tunggu Keluarga Ambil 4 Jenazah Di RSUD Pandeglang";"None"
"1292";"1476";"3";"12 Korban Tsunami Terdata Peserta BPJS Ketenagakerjaan";"None"
"1296";"1480";"3";"Pastor Kesaryanto: Bersihkan Hati Yang Mengotori Hidup Kita";"None"
"1299";"1483";"3";"107 Pasien Ditangani Rumkitlap Marinir Di Hari Pertama";"None"
"1301";"1485";"3";"Sampaikan Duka Cita, AS Terus Memonitor Penanganan Tsunami";"None"
"1302";"1486";"3";"Kirim Pesan Lewat Jokowi, Presiden China Ikut Berduka Cita";"None"
"1304";"1488";"3";"Seorang Pria Berteriak \"Hidup Ahok!\" Saat Anies Di Gereja Paulus";"None"
"1305";"1489";"3";"BNPB Catat Korban Meninggal Akibat Tsunami 373 Orang";"None"
"1306";"1490";"3";"Fraksi PKS Galang Dana Bantuan Korban Tsunami";"None"
"1307";"1491";"3";"Tak Capai Setengah Plus Satu, Waktu Kongres KNPI Putaran Kedua Belum Ditentukan";"None"
"1308";"1492";"3";"Presiden Jokowi Sudah Instruksikan Pendidikan Kebencanaan";"None"
"1309";"1493";"3";"Dua Alasan Kuat Untuk Saddam Mundur Dari Ketua Umum PB HMI";"None"
"1310";"1494";"3";"Di Gereja St Andreas Kim Taegon, Gubernur Anies Sampaikan Pesan Kesederhanaan";"None"
"1311";"1495";"3";"Tidak Ada Identitas Dan Antemortem Minim, 37 Jenazah Tsunami Banten Belum Teridentifikasi";"None"
"1312";"1496";"5";"OTT Kemenpora, Gerindra Minta KPK Geledah Ruang Kerja Imam Nahrawi";"None"
"1313";"1497";"5";"Suap Di Kemenpora Semakin Membuktikan Ucapan Prabowo";"None"
"1314";"1498";"5";"Bareskrim Panggil Manager Madura FC Terkait Pengaturan Skor";"None"
"1315";"1499";"5";"Pelapor Ali Mochtar Ngabalin Kecewa Dengan Bareskrim";"None"
"1316";"1500";"5";"OTT Hibah Kemenpora, KPK Didesak Periksa Menteri Imam Nahrawi";"None"
"1317";"1501";"5";"Lima Tersangka Suap KONI Kemenpora Ditahan Di Rutan Terpisah";"None"
"1318";"1502";"5";"KPK Periksa Mantan Gubernur Jabar Sebagai Saksi";"None"
"1319";"1503";"5";"Duit Operasional KONI Dikorupsi Sementara Pegawai 5 Bulan Tak Terima Gaji";"None"
"1320";"1504";"5";"Hakim Tipikor Cabut Hak Politik Enam Legislator Malang";"None"
"1321";"1505";"5";"Pimpinan KPK: Asisten Pribadi Menpora Terindikasi Punya Peran Signifikan";"None"
"1322";"1506";"5";"Asisten Pribadi Menpora Turut Diperiksa KPK";"None"
"1323";"1507";"5";"Anak Buah Menteri Imam Nahrawi Minta Fee Rp 3,4 Miliar";"None"
"1324";"1508";"5";"KPK Amankan Uang Tunai Miliaran Rupiah Dan Sebuah Mobil";"None"
"1325";"1509";"5";"Komisi III Bakal Klarifikasi Polri Terkait SP3 Gunawan Jusuf";"None"
"1326";"1510";"5";"KPK Tetapkan Lima Tersangka";"None"
"1327";"1511";"5";"Polisi Tidak Boleh Kalah Tuntaskan Kasus Penganiayaan Bahar Bin Smith";"None"
"1328";"1512";"5";"Langkah Orangtua Korban Laporkan Bahar Bin Smith Diapresiasi";"None"
"1329";"1513";"5";"KPK Siapkan Status Hukum Hasil OTT Kemenpora";"None"
"1330";"1514";"5";"Presiden Jokowi Kalah Digugat Dalam Perkara Wajib Kerja Dokter Spesialis";"None"
"1331";"1515";"5";"Bahar Bin Smith Aktor Intelektual Pengeroyokan Dua Remaja";"None"
"1332";"1516";"5";"Utang Negara Bukan Ranah KPK, Laporan Eggi Sudjana Tak Dapat Ditindaklanjuti";"None"
"1333";"1517";"5";"Seharusnya Bahar Bin Smith Lapor Kalau Dirugikan, Bukan Main Hakim Sendiri";"None"
"1334";"1518";"5";"KPK: OTT 2018 Terbanyak Sepanjang Sejarah";"None"
"1335";"1519";"5";"Bahar Bin Smith Suruh Korban Duel Di Lapangan Sambil Ditonton Santri";"None"
"1336";"1520";"5";"KPK Mau Terapkan Sanksi Korporasi Tak Ikut Lelang";"None"
"1337";"1521";"5";"Proses Hukum RJ Lino, KPK Terhambat Data Harga Alat Bukti";"None"
"1338";"1522";"5";"Kasus Suap Paling Banyak Ditangani KPK Selama 2018";"None"
"1339";"1523";"5";"Pimpinan KPK: LHKPN Anggota Dewan Daerah Masih Rendah";"None"
"1340";"1524";"5";"Beredar Rekaman Suara Bahar Bin Smith, Berisi Alasan Aniaya 2 Remaja";"None"
"1341";"1525";"5";"Praperadilan Chuck Ditolak, Haris Azhar Janji Bongkar Dugaan Korupsi Kejagung";"None"
"1342";"1526";"5";"Ketua KPK: Laporan Kinerja Sebagai Bentuk Transparansi";"None"
"1343";"1527";"5";"KPK Periksa Empat Tersangka Suap DPRD Kalteng";"None"
"1344";"1528";"5";"Keluarga Minta Pembunuh Acuan Dihukum Mati";"None"
"1345";"1529";"5";"KPK Amankan Uang Tunai Rp 300 Juta Dan Sebuah Kartu ATM";"None"
"1346";"1530";"5";"KPK Segel Satu Ruangan Di Kemenpora";"None"
"1347";"1531";"5";"Habib Bahar Diduga Berencana Aniaya Dua Anak Di Bawah Umur";"None"
"1348";"1532";"5";"Sesmenpora: Deputi IV Yang Diamankan KPK";"None"
"1349";"1533";"5";"Polisi: Tak Hanya Habib Bahar, Lima Anak Buahnya Turut Ditahan";"None"
"1350";"1534";"5";"Sembilan Orang Diamankan KPK, Kini Diperiksa Intensif";"None"
"1351";"1535";"5";"KPK Benarkan OTT Pejabat Kemenpora Terkait Kasus Dana Hibah KONI";"None"
"1352";"1536";"5";"Satgas Saber Pungli Tegahi Kasus Enclave Di KEK Mandalika";"None"
"1353";"1537";"5";"Mabes Polri Benarkan Bahar Bin Smith Ditahan Polda Jabar";"None"
"1354";"1538";"5";"Polda Jabar Tahan Bahar Bin Smith Atas Kasus Penganiayaan";"None"
"1355";"1539";"5";"Satu Ruangan Di Kemenpora Disegel KPK";"None"
"1356";"1540";"5";"Delapan Penerima Suap Gatot Siap Disidang";"None"
"1357";"1541";"5";"Setya Novanto Prihatin Keponakannya Divonis Berat";"None"
"1358";"1542";"5";"Taufik Kurniawan Tidak Bergairah Jelaskan Kasus";"None"
"1359";"1543";"5";"Bareskrim Dan PSSI Segera Bentuk Satgas Berantas Mafia Skor";"None"
"1360";"1544";"5";"Serikat Pekerja JICT Pertanyakan Proses Hukum RJ Lino Ke KPK";"None"
"1361";"1545";"5";"Lima Orang Terkait Proyek Fiktif Waskita Karya Dicegah Ke Luar Negeri";"None"
"1362";"1546";"5";"Berkas Perkara Habib Bahar Diserahkan Ke JPU Pekan Depan";"None"
"1363";"1547";"5";"Bagi Setnov, Hidup Di Penjara Seperti Di Pesantren";"None"
"1364";"1548";"5";"Tangkap Bupati Irvan, KPK Dapat Piala Dari Warga Cianjur";"None"
"1365";"1549";"5";"Setya Novanto Tidak Tahu Ada Bilik Cinta Di Sukamiskin";"None"
"1366";"1550";"5";"Taufik Kurniawan Kembali Jalani Pemeriksaan Sebagai Tersangka";"None"
"1367";"1551";"5";"Disebut Beri Suap, Tiga Petinggi Swasta Bersaksi Untuk Idrus Marham";"None"
"1368";"1552";"5";"Banyak Yang Nangis Minta Hukum Ditunda";"None"
"1369";"1553";"5";"Dirut Jasa Tirta II Diperiksa Perdana Sebagai Tersangka KPK";"None"
"1370";"1554";"5";"Yusril Ihza Akan Bela Maghfirah, Ibu Tiga Bayi Kembar Di Rutan Bireun";"None"
"1371";"1555";"5";"Ungkap Korupsi Infrastruktur, KPK Geledah Sejumlah Tempat Di Jakarta Dan Surabaya";"None"
"1372";"1556";"1";"Surya Paloh Tak Masalah TGB Gabung Golkar";"None"
"1373";"1557";"1";"20 Delegasi Uni Eropa Menyambangi NasDem";"None"
"1377";"1561";"1";"Debat Capres Tanpa Pengerahan Massa";"None"
"1378";"1562";"1";"Agung Yulianto Klaim Cocok Jadi Pendamping Anies";"None"
"1379";"1563";"1";"Isu Poligami Dapat Menarik Simpati Perempuan";"None"
"1380";"1564";"1";"Tidak Semua Tokoh Politik Bisa Ditiru";"None"
"1381";"1565";"1";"Narasi 'Indonesia Punah' seperti Peluru Kosong";"None"
"1382";"1566";"1";"Luhut: Jangan Asal Ngomong Indonesia Punah";"None"
"1383";"1567";"1";"Demokrat Menuding Ada Institusi Siluman";"None"
"1384";"1568";"1";"Demokrat Kecam Pernyataan Wiranto Terkait Perusakan Baliho";"None"
"1385";"1569";"1";"PSI: Poligami Memperdaya Perempuan";"None"
"1386";"1570";"1";"Akhir Desember UU Pesantren Dibawa ke DPR";"None"
"1387";"1571";"1";"Megawati: Hari Ibu Momentum Gerakan Politik Perempuan";"None"
"1388";"1572";"1";"Keluarga Benteng Terdepan Mencegah Penyalahgunaan Narkoba";"None"
"1389";"1573";"1";"Bawaslu Polri Selidiki Perusakan Atribut Demokrat";"None"
"1390";"1574";"1";"Wiranto: Pernyataan Prabowo Ancaman Serius";"None"
"1391";"1575";"1";"Pemerintah Dinilai Berupaya Menyejahterakan Prajurit";"None"
"1392";"1576";"1";"Kenaikan Tunjangan Babinsa Tak Pengaruhi Suara Jokowi";"None"
"1393";"1577";"1";"Jokowi: Perbedaan di Indonesia Anugerah";"None"
"1394";"1578";"1";"Demokrat Gelar Rapat Darurat di Rumah SBY";"None"
"1395";"1579";"1";"Surya Paloh Sowan ke Ulama Jember";"None"
"1396";"1580";"1";"Penasihat Fraksi Gerindra DPRD DKI Meninggal";"None"
"1397";"1581";"1";"Kemendagri Luncurkan 15 Layanan Daring";"None"
"1398";"1582";"1";"Kedaulatan Sebuah Keharusan";"None"
"1399";"1583";"1";"Rumah Gerakan 98 Tolak Kembalinya Orde Baru";"None"
"1400";"1584";"1";"Reklame Raksasa Raib, PSI Ambil Langkah Hukum";"None"
"1401";"1585";"1";"Presiden Jokowi Berikan Kenaikan Tunjangan Babinsa";"None"
"1402";"1586";"1";"Pernyataan Grace Natalie Soal Poligami Ditentang";"None"
"1403";"1587";"1";"TGB Resmi Bergabung ke NasDem";"None"
"1404";"1588";"1";"Surya Paloh Ingin Swasembada Bawang Putih";"None"
"1405";"1589";"1";"Andi Arief: Pelaku Perusakan Mengaku Disuruh PDIP";"None"
"1406";"1590";"1";"Bawaslu Diminta Usut Dalang Perusak Atribut Demokrat";"None"
"1407";"1591";"1";"PSI Yakin Isu Poligami Tak Ganggu Jokowi";"None"
"1408";"1592";"1";"PSI Disebut Partai Perempuan";"None"
"1409";"1593";"1";"Gerindra Minta PSI Ributkan Prostitusi Ketimbang Poligami";"None"
"1411";"1595";"1";"TGB Tegaskan Komitmen Nahdlatul Wathan Merawat NKRI";"None"
"1412";"1596";"1";"Santri Diminta Menjadi Juru Penerang Islam";"None"
"1413";"1597";"1";"Surya Paloh Beri Kuliah Kebangsaan di Ponpes Nahdlatul Wathan";"None"
"1414";"1598";"1";"NasDem Usulkan Tokoh Muda sebagai Wagub DKI";"None"
"1415";"1599";"1";"Surya Paloh Ingatkan Pentingnya Nilai Pancasila";"None"
"1416";"1600";"1";"Survei: Mayoritas Warga Tolak Perda Agama";"None"
"1417";"1601";"1";"Pemerintah Diminta Tindak Tegas KKB Papua";"None"
"1418";"1602";"1";"Surya Paloh Ingatkan Pentingnya Mempersiapkan Generasi Penerus";"None"
"1419";"1603";"1";"Presiden Janji Percepat Pembahasan RUU Pesantren";"None"
"1420";"1604";"1";"Surya Paloh Beri Kuliah Umum Kebangsaan di Lombok";"None"
"1421";"1605";"1";"Kinerja DPR yang `Ajaib`";"None"
"1423";"1607";"1";"Jokowi Heran Marak Umpatan Kasar";"None"
"1424";"1608";"1";"Pemerintah Diminta Pertimbangkan Usulan Operasi Militer di Papua";"None"
"1425";"1609";"1";"Kalla Terkesan dengan Kesederhanaan Jokowi";"None"
"1426";"1610";"1";"Keputusan MK Kabulkan Uji Materi UU Perkawinan Diapresiasi";"None"
"1427";"1611";"1";"Indonesia Tegaskan Komitmen Penerapan Perjanjian Paris";"None"
"1428";"1612";"1";"Perempuan Muhammadiyah Dukung Larangan Poligami";"None"
"1429";"1613";"3";"Dirjen PFM Fokus Tingkatkan Kualitas Pelayanan Bansos";"None"
"1430";"1614";"3";"Jokowi: Calon Pemimpin Harus Suguhkan Adu Visi Misi";"None"
"1431";"1615";"3";"Harapan Mohammad Nuh dan Wardiman untuk Museum Pendidikan";"None"
"1432";"1616";"3";"Empat Mantan Menteri Pendidikan Reuni di Senayan";"None"
"1435";"1619";"3";"186 PPKD Sudah di Tangan Kemendikbud";"None"
"1436";"1620";"3";"Anies Ingin Guru Madrasah Jadi Pendidik Abad 21";"None"
"1437";"1621";"3";"Polri: Lapangan Tembak Senayan Bisa Dipindah";"None"
"1438";"1622";"3";"Pendidikan Berkelas Internasional Hadir di Surabaya";"None"
"1439";"1623";"3";"Proyektil Peluru di Ruangan Vivi Diuji Balistik";"None"
"1440";"1624";"3";"Menristekdikti Mengisyaratkan Moratorium di Sejumlah Prodi LPTK";"None"
"1441";"1625";"3";"Vivi Sempat tak Percaya Lubang di Ruangan dari Tembakan";"None"
"1442";"1626";"3";"Di UAI, Lulusan Cum Laude Bonus Naik Haji";"None"
"1443";"1627";"3";"Lubang Baru di Gedung DPR Sisa Tembakan Senin";"None"
"1444";"1628";"3";"Jokowi Kaget Klaim Penyakit Jantung Rp9 Triliun";"None"
"1445";"1629";"3";"PGMI Dorong Madrasah Sejajar dengan Sekolah Umum";"None"
"1446";"1630";"3";"Sebagian Napi Kabur di Palu Sudah Kembali";"None"
"1447";"1631";"3";"Polisi Bawa Satu Kotak dari Lokasi Penembakan DPR";"None"
"1448";"1632";"3";"Dirjen PFM Fokus Tingkatkan Kualitas Pelayanan Bansos";"None"
"1449";"1633";"3";"Jokowi: Calon Pemimpin Harus Suguhkan Adu Visi Misi";"None"
"1450";"1634";"3";"Harapan Mohammad Nuh dan Wardiman untuk Museum Pendidikan";"None"
"1451";"1635";"3";"Empat Mantan Menteri Pendidikan Reuni di Senayan";"None"
"1454";"1638";"3";"186 PPKD Sudah di Tangan Kemendikbud";"None"
"1455";"1639";"3";"Anies Ingin Guru Madrasah Jadi Pendidik Abad 21";"None"
"1456";"1640";"3";"Polri: Lapangan Tembak Senayan Bisa Dipindah";"None"
"1457";"1641";"3";"Pendidikan Berkelas Internasional Hadir di Surabaya";"None"
"1458";"1642";"3";"Proyektil Peluru di Ruangan Vivi Diuji Balistik";"None"
"1459";"1643";"3";"Menristekdikti Mengisyaratkan Moratorium di Sejumlah Prodi LPTK";"None"
"1460";"1644";"3";"Vivi Sempat tak Percaya Lubang di Ruangan dari Tembakan";"None"
"1461";"1645";"3";"Di UAI, Lulusan Cum Laude Bonus Naik Haji";"None"
"1462";"1646";"3";"Lubang Baru di Gedung DPR Sisa Tembakan Senin";"None"
"1463";"1647";"3";"Jokowi Kaget Klaim Penyakit Jantung Rp9 Triliun";"None"
"1464";"1648";"3";"PGMI Dorong Madrasah Sejajar dengan Sekolah Umum";"None"
"1465";"1649";"3";"Sebagian Napi Kabur di Palu Sudah Kembali";"None"
"1466";"1650";"3";"Polisi Bawa Satu Kotak dari Lokasi Penembakan DPR";"None"
"1467";"1651";"3";"Dirjen PFM Fokus Tingkatkan Kualitas Pelayanan Bansos";"None"
"1468";"1652";"3";"Jokowi: Calon Pemimpin Harus Suguhkan Adu Visi Misi";"None"
"1469";"1653";"3";"Harapan Mohammad Nuh dan Wardiman untuk Museum Pendidikan";"None"
"1470";"1654";"3";"Empat Mantan Menteri Pendidikan Reuni di Senayan";"None"
"1473";"1657";"3";"186 PPKD Sudah di Tangan Kemendikbud";"None"
"1474";"1658";"3";"Anies Ingin Guru Madrasah Jadi Pendidik Abad 21";"None"
"1475";"1659";"3";"Polri: Lapangan Tembak Senayan Bisa Dipindah";"None"
"1476";"1660";"3";"Pendidikan Berkelas Internasional Hadir di Surabaya";"None"
"1477";"1661";"3";"Proyektil Peluru di Ruangan Vivi Diuji Balistik";"None"
"1478";"1662";"3";"Menristekdikti Mengisyaratkan Moratorium di Sejumlah Prodi LPTK";"None"
"1479";"1663";"3";"Vivi Sempat tak Percaya Lubang di Ruangan dari Tembakan";"None"
"1480";"1664";"3";"Di UAI, Lulusan Cum Laude Bonus Naik Haji";"None"
"1481";"1665";"3";"Lubang Baru di Gedung DPR Sisa Tembakan Senin";"None"
"1482";"1666";"3";"Jokowi Kaget Klaim Penyakit Jantung Rp9 Triliun";"None"
"1483";"1667";"3";"PGMI Dorong Madrasah Sejajar dengan Sekolah Umum";"None"
"1484";"1668";"3";"Sebagian Napi Kabur di Palu Sudah Kembali";"None"
"1485";"1669";"3";"Polisi Bawa Satu Kotak dari Lokasi Penembakan DPR";"None"
"1486";"1670";"5";"Augie Fantinus Segera Disidang";"None"
"1487";"1671";"5";"Polisi Sempat Usut Kasus Pengaturan Skor Bola";"None"
"1488";"1672";"5";"Shinta Senang Dapat Rp20 Juta Bantu Pelarian Eddy";"None"
"1489";"1673";"5";"KPK Bidik Anggota DPR Lain di Kasus Bakamla";"None"
"1490";"1674";"5";"Satgas Mafia Bola Bekerja Tahun Depan";"None"
"1491";"1675";"5";"Kader PDIP Mendominasi Daftar OTT KPK";"None"
"1492";"1676";"5";"IPhone X Jadi Pelicin Pelarian Eddy Sindoro";"None"
"1493";"1677";"5";"Peran Imam Nahrawi pada Dugaan Suap di Kemenpora Signifikan";"None"
"1494";"1678";"5";"Indonesia Gandeng Swiss Melacak Uang Koruptor";"None"
"1495";"1679";"5";"Direktur SDM PT Adhi Karya Diperiksa KPK";"None"
"1496";"1680";"5";"Pengacara Tagih Penyelesaian Berkas Perkara Ratna";"None"
"1497";"1681";"5";"Direktur Keuangan Waskita Wado Energi 'Digarap' KPK";"None"
"1498";"1682";"5";"Ahmad Heryawan Dipanggil KPK";"None"
"1499";"1683";"5";"Lima Tersangka Suap Kemenpora Ditahan";"None"
"1500";"1684";"5";"Ditjen PAS: Remisi Ahok Tunggu SK Menkumham";"None"
"1501";"1685";"5";"OTT Dana Hibah KONI tak Ganggu Prestasi Atlet";"None"
"1502";"1686";"5";"KPK Mengindikasi Dugaan Korupsi Penyelenggaraan Asian Games";"None"
"1503";"1687";"5";"Kasus RJ Lino Dipastikan Rampung Sebelum Ganti Pimpinan KPK";"None"
"1504";"1688";"5";"Pejabat Kemenpora jadi Tersangka Suap Dana Hibah KONI";"None"
"1505";"1689";"5";"KPK Endus Dugaan Korupsi Lain di Kemenpora";"None"
"1506";"1690";"5";"Peran PT Waskita pada 14 Proyek Fiktif Diselidiki";"None"
"1507";"1691";"5";"KPK Minta Pemberian Remisi Diperketat";"None"
"1508";"1692";"5";"Eks Petinggi Universitas Udayana Dituntut 4 Tahun Bui";"None"
"1509";"1693";"5";"OTT Sepanjang 2018 Mencetak Sejarah";"None"
"1510";"1694";"5";"Habib Bahar Aktor Utama Penganiayaan Anak";"None"
"1511";"1695";"5";"Wartawan Diminta Lebih Sensitif terhadap Pemberitaan Anak";"None"
"1512";"1696";"5";"21 Kode Suap Meikarta, dari Santa sampai Tina Toon";"None"
"1514";"1698";"5";"Korupsi Dana Hibah Masuk Rekening Pejabat Kemenpora";"None"
"1515";"1699";"5";"Billy Sindoro Dikdawa Suap Bupati Bekasi Rp11,783 Miliar";"None"
"1516";"1700";"5";"Legislator Daerah Paling Malas Lapor Harta Kekayaan";"None"
"1517";"1701";"5";"Jokowi Blak-blakan Soal Kriminalisasi Ulama di Madura";"None"
"1518";"1702";"5";"Kadiv P3 Perum Jasa Tirta II Diperiksa KPK";"None"
"1519";"1703";"5";"Bukti Pertemuan Dirut PLN dengan Tersangka Dipertajam";"None"
"1520";"1704";"5";"Praperadilan Jaksa Chuck Suryosumpeno Ditolak";"None"
"1521";"1705";"5";"Deputi IV Prestasi Olahraga Diduga Terlibat Korupsi Kemenpora";"None"
"1522";"1706";"5";"Uang Rp300 Juta Diamankan dari OTT Kemenpora";"None"
"1523";"1707";"5";"OTT Diduga Terkait Dana Hibah untuk KONI";"None"
"1524";"1708";"5";"KPK Dikabarkan Tangkap Pejabat Kemenpora";"None"
"1525";"1709";"5";"Ahmad Sudiro Terpilih Menjadi Ketua Umum BADAPSKI";"None"
"1526";"1710";"5";"Polri Bentuk Satgas untuk Memberantas Mafia Sepak Bola";"None"
"1527";"1711";"5";"KPK Tetapkan Bupati Mojokerto Tersangka Pencucian Uang";"None"
"1528";"1712";"5";"Taufik Ungkap Aliran Suap ke PAN";"None"
"1529";"1713";"5";"KPK Kumpulkan Bukti untuk Menjerat Dirut PLN";"None"
"1530";"1714";"5";"Novanto Tak Tahu Ada Bilik Asmara";"None"
"1531";"1715";"5";"Habib Bahar Diperiksa Atas Kasus Kekerasan Anak";"None"
"1532";"1716";"5";"Novanto Tak Tahu Bakal Diguyur Rp91 Miliar";"None"
"1533";"1717";"5";"Kotjo Sebut Novanto Berjasa dalam Proyek PLTU Riau-I";"None"
"1534";"1718";"5";"Empat Petinggi PT Waskita Karya Dicegah";"None"
"1535";"1719";"5";"Novanto Prihatin Irvanto Dihukum 10 Tahun Penjara";"None"
"1536";"1720";"5";"Berkas Perkara Bahar Smith Segera Rampung";"None"
"1538";"1722";"5";"Sejumlah Petinggi Waskita Langsung Diperiksa Intensif";"None"
"1539";"1723";"5";"Petinggi PT Smelting Diperiksa Kasus Suap PLTU Riau-I";"None"
"1540";"1724";"5";"Novanto dan Johannes Kotjo Bersaksi untuk Eni";"None"
"1541";"1725";"5";"KPK Bidik PT Waskita Karya di Korupsi 14 Proyek";"None"
"1542";"1726";"5";"Tersangka Bantah Satu Adegan Rekonstruksi Pengeroyokan TNI di Ciracas";"None"
